{
  "schema_version": 1,
  "record_type": "story-runtime-skill-metadata",
  "identity": {
    "slug": "erotic-dynamics-prose",
    "label": "Erotic dynamics prose",
    "category": "roleplay-response",
    "summary": "Adult erotic-romance prose and revision skill that treats heat as attention, consequence, character voice, and camera distance rather than a separate plot mode or vocabulary swap."
  },
  "provenance": {
    "source": "heartwrite_memory_vault",
    "source_links": [
      "erotic-dynamics-prose/SKILL.md",
      "erotic-dynamics-prose/references/dynamics-deep.md",
      "erotic-dynamics-prose/references/heat-levels.md",
      "erotic-dynamics-prose/references/voice-card.md",
      "power-dynamics-scene-writing/SKILL.md",
      "dominance-and-intimacy-flow/SKILL.md",
      "domain-vocabulary-seeds/SKILL.md"
    ],
    "repository_body": "skills/erotic-dynamics-prose/SKILL.md"
  },
  "runtime": {
    "status": "reviewed",
    "public_safe": false,
    "scopes": ["prompt_book", "character_book", "scenario_book", "memory_book"]
  },
  "activation": {
    "mode": "contextual",
    "tags": [
      "erotic_dynamics_prose",
      "heat_register_calibration",
      "camera_dial_not_plot_dial",
      "voice_card",
      "dynamic_as_engine",
      "attention_consequence_heat",
      "character_specific_dirty_talk",
      "authority_signature_variety",
      "landing_aftercare"
    ],
    "trigger_seeds": [
      "erotic dynamics prose",
      "camera dial",
      "heat level",
      "voice card",
      "flat and floaty",
      "hot but empty",
      "generic dirty talk",
      "write this hotter",
      "explicit register",
      "graphic register",
      "make it theirs",
      "landing"
    ]
  },
  "state": {
    "fields": [
      "requested_heat_register",
      "camera_distance",
      "dynamic_engine",
      "voice_card_status",
      "character_specific_tell",
      "authority_signature",
      "body_grounding",
      "emotional_consequence",
      "resistance_or_choice_beat",
      "attention_read",
      "landing_required",
      "revision_failure_mode"
    ]
  },
  "routing": {
    "prompt_compiler_signals": [
      "erotic-dynamics-prose-route",
      "heat-register-check",
      "camera-distance-check",
      "voice-card-required",
      "authority-variety-check",
      "attention-consequence-check",
      "flat-floaty-diagnostic",
      "hot-empty-diagnostic",
      "landing-required-check"
    ],
    "memory_routing": [
      "Use for prose drafting, revision, and QC when an adult erotic-romance scene needs heat-level calibration, stronger character voice, or dynamics with consequence.",
      "Route durable voice-card facts, words that work, speech breakdowns, taboo terms, and touch-history constraints to Character Book when the author saves them.",
      "Route durable authority signatures to Character Book so leading characters do not collapse into the same quiet-control archetype across scenes.",
      "Route active heat register, dynamic engine, body grounding, position readability, attention reads, and landing requirements to Scenario Book.",
      "Route meaningful intimacy consequences, changed power dynamics, aftercare revelations, or recurring words/rituals to Memory Book."
    ],
    "continuity_links": [
      "power-dynamics-scene-writing",
      "dominance-and-intimacy-flow",
      "domain-vocabulary-seeds",
      "erotic-archetypes-engine",
      "romantic-speech-pattern",
      "emotional-subtext-engine",
      "desire-physical-awareness",
      "intimacy-shift",
      "relationship-tracker",
      "flaw-preservation"
    ]
  },
  "safety": {
    "guardrails": [
      "Adult consensual fiction only; explicit and graphic registers are allowed only inside the established adult-consent frame.",
      "Do not dictate {{user}} thoughts, feelings, consent, arousal, orgasm, dialogue, final action, or emotional conclusion.",
      "Treat register as camera distance, not plot escalation; explicit changes how far into the body the prose goes, not what must happen.",
      "Do not make authority synonymous with stillness or low speech; control can be loud, delighted, playful, hungry, practical, theatrical, or warm when that fits the character.",
      "Do not downgrade explicit or graphic requests into coy euphemism when platform route, adult context, and character voice allow direct language.",
      "Do not attack character worth for intensity; claim the person, never their worth.",
      "Above moderate intensity, require a landing or aftercare beat unless the author explicitly wants unresolved fallout."
    ],
    "user_agency": "preserve",
    "consent_context": "required",
    "private_data_policy": "approved_source_only"
  },
  "extensions": {}
}
